"ダークソウル1","その他","矢・ボルト","標準的な矢威力、飛距離共に見るべきところはないが単価が安く、大量使用に適する（アイテム: 不明）\n\n---\n\n標準的な矢何らかの矢を装備しないと弓を撃つことはできない（アイテム: 不明）\n\n---\n\n大型の矢重く威力も高いが、飛距離は短くなる（アイテム: 不明）\n\n---\n\n王の狩人が用いる赤羽の矢飛距離が長く、遠距離からの狙撃に適する（アイテム: 不明）\n\n---\n\n矢じりに火をつけて撃つ矢炎属性のダメージを与える（アイテム: 不明）\n\n---\n\n矢じりに毒を塗った矢狩りや暗殺の確実性を高めるためのもの敵が毒状態になったら、あとは待てばよいのだ（アイテム: 不明）\n\n---\n\nグウィン王の末子にして、陰の太陽グウィンドリンの誓約者に与えられる魔法の矢その矢は銀の光を帯び、魔法ダメージを与える（アイテム: 不明）\n\n---\n\n竜狩りの大弓専用の、鉄槍のように巨大な矢「鷹の目」ゴーの率いた竜狩り隊のもので人のごときは簡単に貫いてしまうこの大矢は竜狩りの大弓でしか使えずまた、竜狩りの大弓はこの大矢しか使えない（アイテム: 不明）\n\n---\n\nグウィン王の四騎士の一人「鷹の目」ゴーの用いた竜狩りの大矢大弓専用石の矢じりも、きつく巻かれた樹皮もすべてゴー自身の手になるものである（アイテム: 不明）\n\n---\n\n木製の簡易なボルト威力、飛距離共に見るべきところはないが単価が安く、大量使用に適する（アイテム: 不明）","https://seesaawiki.jp/fromsoft_flavor-text/d/DSR%cc%f0%a1%a6%a5%dc%a5%eb%a5%c8"
"ダークソウル3","その他","消耗品","花付き緑花草（シーリス）（アイテム: 不明）\n\n---\n\n幼い白枝（おくりもの）（アイテム: 不明）\n\n---\n\n鈍い緑色のガラス瓶不死人の宝篝火でエストを溜め、飲んでＨＰを回復する古くより、不死の旅は篝火を巡りエスト瓶はいつも旅と共にあった（アイテム: 不明）\n\n---\n\n鈍い灰色のガラス瓶火の無い灰の宝篝火でエストを溜め、飲んでＦＰを回復する篝火の熱を、冷たく変える灰瓶は火の無い灰にこそ相応しいだろう（アイテム: 不明）\n\n---\n\n英雄たちの内にある残り火火の無き灰たちが終に得られず故に惹かれるもの死ぬまで火の力を得、最大ＨＰを増やすまた、火の力を得た者にはサインが見え残り火に惹かれる協力者を召喚できるだが同時に、侵入者の影も付き纏うだろう（アイテム: 不明）\n\n---\n\nエストの染み付いた破片祭祀場の鍛冶屋に渡すことでエスト瓶の使用回数を増やす古来エスト瓶は不死と共にありこれは砕かれた希望なのだろう（アイテム: 不明）\n\n---\n\nまだ燃え尽きていない、不死人の遺骨祭祀場の篝火にくべ、エストの回復量を高める篝火の薪は不死人の骨でありまだ燃え尽きぬそれは新しい薪になる死を糧とするのなら、死に祈ることだ（アイテム: 不明）\n\n---\n\nロスリックの王妃が祝福したとされる聖水ＨＰを完全に回復し、全ての異常を癒す彼女は先王オスロエスの妻であり豊穣と恵みの女神にすら例えられたが末子オセロットを産んで後、姿を消したという（アイテム: 不明）\n\n---\n\nカタリナのジークバルト謹製の酒樽のジョッキに満たされた旅用の品ＨＰを回復し、一時的に冷気耐性も高める本来、不死人が酒を楽しめるはずもなくジークバルトは何らかの工夫を凝らしたのだろう不死の時はあまりに長く、酒と謳歌が欲しいのだ（アイテム: 不明）\n\n---\n\n弱い魔力を帯びた金属粉装備している武器、防具を修理する耐久度ゼロの武器は対象とならない武器や防具は使い続けると耐久度が下がりこれがゼロになると壊れてしまう壊れていなければ、耐久度は篝火で回復するが念のため、旅先での修理手段を用意しておくとよい（アイテム: 不明）","https://seesaawiki.jp/fromsoft_flavor-text/d/DS3%be%c3%cc%d7%c9%ca"
"ダークソウル3","その他","投擲アイテム","投擲用の小型ナイフ敵に投げつけ、ダメージを与える多くのアイテムは使い手を選び熟練の使い手は、その威力をさらに高める力を得るとは、いつでもそういうことだ（アイテム: 不明）\n\n---\n\n毒の塗られた投擲用ナイフ敵に投げつけ、毒を伴うダメージを与える亡者の国ロンドールの刺客たちの武器その毒は亡者の血であると揶揄される（アイテム: 不明）\n\n---\n\n投擲用の小型湾刀敵に投げつけ、出血を伴うダメージを与えるカーサスの剣士たちが用いた独特の武器だがいまや盗賊や盗人の類が好んで使用している（アイテム: 不明）\n\n---\n\nフィリアノールの教会守りたちが持つ切っ先の平らな薄刃。特殊な投擲武具ＦＰを消費することで敵に向かい導かれるように飛ぶ薄刃の幻影を投じるいまや数少ない教会守りは、教会の槍と共に王女フィリアノールの永い眠りの番人である（アイテム: 不明）\n\n---\n\n火薬の詰められた素焼きの壺敵に投げつけ、爆発して炎ダメージを与える物理とは異なる炎属性のダメージは生身の肉体や獣など炎に焼かれ、恐れる敵に効果が高い（アイテム: 不明）\n\n---\n\n「火炎壺」に投擲用の紐を付けたもの背後に投げ、爆発して炎ダメージを与える投げる方向以外は火炎壺と変わらない戦闘スタイルや状況に応じ、使い分けるとよいだろう（アイテム: 不明）\n\n---\n\n特殊な火薬により威力を増した「火炎壺」敵に投げつけ、爆発して大きな炎ダメージを与える物理とは異なる炎属性のダメージは生身の肉体や獣など炎に焼かれ、恐れる敵に効果が高い（アイテム: 不明）\n\n---\n\n「黒火炎壺」に投擲用の紐を付けたもの背後に投げ、爆発して炎ダメージを与える投げる方向以外は黒火炎壺と変わらない戦闘スタイルや状況に応じ、使い分けるとよいだろう（アイテム: 不明）\n\n---\n\nロスリック騎士たちの竜狩り道具敵に投げつけ、爆発して雷ダメージを与える竜を友とするロスリック騎士は古くは竜狩りの騎士でもあった故に騎士たちは太陽を信仰し特殊な狩り道具を用いたという（アイテム: 不明）\n\n---\n\n乾いた排泄物。大便その割れた内は瑞々しい敵に投げつけ、猛毒を蓄積させるが自分にも猛毒が蓄積していく臭いも強く、あまり持ち歩きたくない類だが不死人は排泄物に懐古を感じるものだろうかいや殆どは、そんなことはないだろう（アイテム: 不明）","https://seesaawiki.jp/fromsoft_flavor-text/d/DS3%c5%ea%da%b3%a5%a2%a5%a4%a5%c6%a5%e0"
"ダークソウル3","その他","ソウル","捨てられた遺体のソウル（アイテム: 不明）\n\n---\n\n捨てられた遺体の大きなソウル（アイテム: 不明）\n\n---\n\n故も知らぬ旅人のソウル（アイテム: 不明）\n\n---\n\n故も知らぬ旅人の大きなソウル（アイテム: 不明）\n\n---\n\n名も無き兵士の大きなソウル（アイテム: 不明）\n\n---\n\n力尽きた戦士の大きなソウル（アイテム: 不明）\n\n---\n\n心折れた騎士の大きなソウル（アイテム: 不明）\n\n---\n\n高名な聖騎士の大きなソウル（アイテム: 不明）\n\n---\n\n勇敢な勇者の大きなソウル（アイテム: 不明）\n\n---\n\n歴戦の勇士の大きなソウル（アイテム: 不明）","https://seesaawiki.jp/fromsoft_flavor-text/d/DS3%a5%bd%a5%a6%a5%eb"
"ダークソウル3","その他","ボスソウル","冷たい谷のボルドのソウル（アイテム: 不明）\n\n---\n\n深みの主教たちのソウル（アイテム: 不明）\n\n---\n\n覇王ウォルニールのソウル（アイテム: 不明）\n\n---\n\n法王サリヴァーンのソウル（アイテム: 不明）\n\n---\n\nデーモンの老王のソウル（アイテム: 不明）\n\n---\n\n妖王オスロエスのソウル（アイテム: 不明）\n\n---\n\n修道女フリーデのソウル（アイテム: 不明）\n\n---\n\nデーモンの王子のソウル（アイテム: 不明）\n\n---\n\n奴隷騎士ゲールのソウル（アイテム: 不明）\n\n---\n\n闇喰らいのミディールのソウル（アイテム: 不明）","https://seesaawiki.jp/fromsoft_flavor-text/d/DS3%a5%dc%a5%b9%a5%bd%a5%a6%a5%eb"
"ダークソウル3","その他","ツール","呪われた不死人の証最後に休息した篝火か、祭祀場の篝火に戻るがソウルを全て失ってしまうこのリングが現れた者は死んでも蘇り、いつか意志なき亡者となる故に彼らは故郷を追われるのだ（アイテム: 不明）\n\n---\n\nもはや役目を終えた篝火の名残篝火と共にあった螺旋剣の破片最後に休息した篝火か、祭祀場の篝火に戻り使用しても失われない篝火はお互い分かち難く繋がっておりたとえ役目を終えた破片であってもその繋がりはずっと残るのだろう（アイテム: 不明）\n\n---\n\n真鍮でできた双眼の遠眼鏡遠くの景色が大きく見えるできることは単純だが、使い方はいろいろあり持つ者によってその価値は大きく変わる（アイテム: 不明）\n\n---\n\n朽ちぬ古竜の力を宿した石竜信仰の秘儀人頭を竜のそれとし、竜のブレスを吐くまたその変態効果は、死ぬまで解けることはない古竜の道を往く者たちはその完全な似姿を得ようとする竜頭の秘儀はその遥か高みの入り口なのだ（アイテム: 不明）\n\n---\n\n奇妙な人面の彫られた古木その由来はまったく伝わっていない地面に投げ落とすと声を発するただそれだけの品…この人面の声は「こんにちは」のようだそう思えば親しげな顔にも見える（アイテム: 不明）\n\n---\n\nロザリアの死体に残っていた神秘のオーブ彼女を殺した者の世界に侵入しその者を倒せば、魂を取り戻せるだろう黒い瞳は復讐の証であるというだが、じっとイルシールをみつめる瞳はとても穏やかに見える（アイテム: 不明）\n\n---\n\nユーザIDを使用しないで書き込む（アイテム: 不明）\n\n---\n\n画像に記載されている文字を下のフォームに入力してください。（アイテム: 不明）\n\n---\n\n利用規約をご確認のうえご記入下さい（アイテム: 不明）\n\n---\n\nフロムソフト フレーバーテキスト\nフロム・ソフトのフレーバーテキストをまとめる場所（アイテム: 不明）","https://seesaawiki.jp/fromsoft_flavor-text/d/DS3%a5%c4%a1%bc%a5%eb"
"ダークソウル3","その他","強化素材","武器を強化する楔石の欠片武器を＋３まで強化するそれは神の原盤から剥がれた薄片であるといわれ武器に刻むことでその武器を強化する（アイテム: 不明）\n\n---\n\n武器を強化する光る楔石力を帯びた武器を＋４まで強化する力を帯びた武器は通常の楔石では強化できずまた変質強化もできないただこの光る楔石だけがその力を消さず、武器を強化できるのだ（アイテム: 不明）\n\n---\n\nソウルにより変質した楔石ソウル錬成された武器を＋４まで強化するソウル錬成によって生まれた武器たちは同じ力を持った楔石でしか強化できないごく稀に結晶トカゲがソウルを喰らい巨大な体に、このウロコを宿すという（アイテム: 不明）\n\n---\n\n楔石が変質化したという貴石ファランの大剣を鍛えて名高い武器の変質強化に使用され重厚な武器を作る重厚な武器は戦士と共にあり特に筋力補正が高くなる（アイテム: 不明）\n\n---\n\nユーザIDを使用しないで書き込む（アイテム: 不明）\n\n---\n\n画像に記載されている文字を下のフォームに入力してください。（アイテム: 不明）\n\n---\n\n利用規約をご確認のうえご記入下さい（アイテム: 不明）\n\n---\n\nフロムソフト フレーバーテキスト\nフロム・ソフトのフレーバーテキストをまとめる場所（アイテム: 不明）\n\n---\n\n楔石の欠片（英名：Titanite Shard） \n\n説明文英文画像武器を強化する楔石の欠片武器を＋３まで強化するそれは神の原盤から剥がれた薄片であるといわれ武器に刻むことでその武器を強化するTitanite shard for weapon reinforcement.Reinforces weapons to +3.Titanite shards are fragments ofthe Legendary Slabs. Titanite isetched into weapons to reinforce.（アイテム: 不明）\n\n---\n\n楔石の大欠片（英名：Large Titanite Shard） \n\n説明文英文画像武器を強化する楔石の欠片その中でも特に大きなもの武器を＋６まで強化するそれは神の原盤から剥がれた薄片であるといわれ武器に刻むことでその武器を強化するTitanite shard for weapon reinforcement.A larger shard that reinforces weapons to +6.Titanite shards are fragments ofthe Legendary Slabs. Titanite isetched into weapons to reinforce.（アイテム: 不明）","https://seesaawiki.jp/fromsoft_flavor-text/d/DS3%b6%af%b2%bd%c1%c7%ba%e0"
"ダークソウル3","その他","マルチプレイ専用","ひび割れた赤い瞳のオーブ（アイテム: 不明）\n\n---\n\nオンラインプレイ専用アイテム協力する、白い召喚サインを書くサインから他世界に霊体として召喚されそのエリアの最後の戦いに勝利すれば火の力を得ることができる全てが淀んだロスリックの地で火の無き灰たちがお互い助け合うための手段（アイテム: 不明）\n\n---\n\n不死の追放者に与えられる決別の証召喚した霊体を元の世界に戻すことができ召喚された他世界から元の世界に戻ることもできるだが、出会いを大切に思うのであれば軽々しくこれを使用するべきではない（アイテム: 不明）\n\n---\n\nユーザIDを使用しないで書き込む（アイテム: 不明）\n\n---\n\n画像に記載されている文字を下のフォームに入力してください。（アイテム: 不明）\n\n---\n\n利用規約をご確認のうえご記入下さい（アイテム: 不明）\n\n---\n\nフロムソフト フレーバーテキスト\nフロム・ソフトのフレーバーテキストをまとめる場所（アイテム: 不明）\n\n---\n\nDS3マルチプレイ専用（アイテム: 不明）\n\n---\n\n白いサインろう石（英名：White Sign Soapstone）（アイテム: 不明）\n\n---\n\n説明文英文画像オンラインプレイ専用アイテム協力する、白い召喚サインを書くサインから他世界に霊体として召喚されそのエリアの最後の戦いに勝利すれば火の力を得ることができる全てが淀んだロスリックの地で火の無き灰たちがお互い助け合うための手段Online play item.Create a co-op summon sign.Be summoned to another world as a phantomthrough your sign, and defeat the area bossto gain the strength of flame.The nature of Lothric is murky, unclear.The White Sign Soapstone allows Unkindledto assist one another.（アイテム: 不明）","https://seesaawiki.jp/fromsoft_flavor-text/d/DS3%a5%de%a5%eb%a5%c1%a5%d7%a5%ec%a5%a4%c0%ec%cd%d1"
"ダークソウル3","その他","誓約アイテム","フィリアノールの槍飾り（アイテム: 不明）\n\n---\n\n「太陽の戦士」の誓約にある者が召喚され、エリア最後の戦いに勝利した証助けられた者もまたこの証を得る太陽のホーリーシンボルが刻まれたメダルはわずかに熱を帯びている分かち合った勝利の、なによりの名誉の証だ（アイテム: 不明）\n\n---\n\n古い青教との約定に基づき神の敵たる闇霊を狩った証耳のない死体は恐怖の対象となり人々は暗月の剣と、神の敵たる不敬を知るだろうそれが陰の太陽の永の使命なのだ（アイテム: 不明）\n\n---\n\n赤い瞳の侵入者たちが火の宿主を倒した証舌を奪って証しとするやり方は元はある侵入者集団の流儀であったという彼らはそれを、声なき女神に捧げるらしい（アイテム: 不明）\n\n---\n\n「積む者」の誓約にある者が他世界の者たちを殺し、見出す特別な骨それは椎骨にひとつだけ見られるもので積む者たちはそれを、神の枷と考えている（アイテム: 不明）\n\n---\n\n老狼と共に戦士たちの眠りを守るファランの番人たちが、その使命を果たした証乾いた血の付いた剣草の葉それはかつて不死隊が連絡に用いた符牒であり腐った森に眠る戦士たちの霊が番人にもたらす承認と感謝の証であるという少なくとも番人たちは、そう信じている（アイテム: 不明）\n\n---\n\nエルドリッチの神喰らいを待ち続ける神喰らいの守り手たちが、その使命を果たした証人の内にある最も重いもの。人の澱みそれはどんな深みにも沈み故にいつか、世界の枷になるという（アイテム: 不明）\n\n---\n\n王女フィリアノールの眠りを守る教会の槍たちが、その使命を果たした証若草の紋章のあしらわれた黄金の飾り布それはかつて、王女の騎士たちの誇りであり特に謳われた、揃いの儀式槍にたなびいたという（アイテム: 不明）\n\n---\n\nユーザIDを使用しないで書き込む（アイテム: 不明）\n\n---\n\n画像に記載されている文字を下のフォームに入力してください。（アイテム: 不明）","https://seesaawiki.jp/fromsoft_flavor-text/d/DS3%c0%c0%cc%f3%a5%a2%a5%a4%a5%c6%a5%e0"
"ダークソウル3","その他","貴重品","王の薪（深淵の監視者）（アイテム: 不明）\n\n---\n\n王の薪（エルドリッチ）（アイテム: 不明）\n\n---\n\n祭祀場の篝火が失った剣武器としては装備できない祭祀場の篝火に刺すことでその力を取り戻し、篝火間の転送を可能とするその剣は選ばれた灰にしか与えられず審判者は鞘となり灰を待ち続けていた（アイテム: 不明）\n\n---\n\nロンドールの儀式剣武器としては装備できない契りの儀式により真の亡者の王が生まれるという伴侶の名はアンリ霊廟の最奥で、王を待っている（アイテム: 不明）\n\n---\n\n深淵の監視者たちが残した王の薪王が玉座に戻らぬならばその薪を戻せばよい血を分け誓った深淵の監視者たちの王の資格は、その狼血にこそあった（アイテム: 不明）\n\n---\n\n巨人ヨームが残した王の薪王が玉座に戻らぬならばその薪を戻せばよい孤独な巨人は、罪の火を鎮めるため薪の王となった彼を王と呼ぶその声に、心がないと知っていても（アイテム: 不明）\n\n---\n\n神喰らいのエルドリッチが残した王の薪王が玉座に戻らぬならばその薪を戻せばよい人喰らいにより王の資格を得たエルドリッチはしかしその玉座に絶望し、神を喰らいはじめた（アイテム: 不明）\n\n---\n\n王子ロスリックが残した王の薪王が玉座につかぬならばその薪をつかせればよい資格者を求めたロスリックの血の営みはやがて人を外れ、おぞましい所業と堕した正に火継ぎとは呪いの道であろう（アイテム: 不明）\n\n---\n\nクールラントの古い錬成炉結晶トカゲの抜け殻を張り合わせ作られている薪の王ルドレスに渡すことでソウル錬成が可能となるこの炉で異形のソウルを錬成することでその特質を凝固させた特別なアイテムが作られる使い方を誤った者が、それを禁忌と呼ぶのだろう（アイテム: 不明）\n\n---\n\n幾つか穴の開いた古い人骨全体に変色している不死街の女遺体が握りしめていたもの女の名をロレッタという（アイテム: 不明）","https://seesaawiki.jp/fromsoft_flavor-text/d/DS3%b5%ae%bd%c5%c9%ca"
"ダークソウル3","その他","矢・ボルト","安価な木の矢威力は低いが、大量に使用できる矢は二種類を装備し状況に応じて切り替えられる（アイテム: 不明）\n\n---\n\n標準的な矢弓と共に用いられる矢は二種類を装備し状況に応じて切り替えられる（アイテム: 不明）\n\n---\n\n大型の矢威力は高いが、重いため飛距離は短い矢は二種類を装備し状況に応じて切り替えられる（アイテム: 不明）\n\n---\n\n狩人が用いる赤羽の矢飛距離が長く、遠距離からの狙撃に適する矢は二種類を装備し状況に応じて切り替えられる（アイテム: 不明）\n\n---\n\n矢じりに火をつけて撃つ矢炎属性のダメージを与える矢は二種類を装備し状況に応じて切り替えられる（アイテム: 不明）\n\n---\n\n矢じりに毒を塗った矢毒を伴うダメージを与えじわじわと敵を死に至らしめる（アイテム: 不明）\n\n---\n\n蛮族の狩人が用いるという儀式の矢闇属性のダメージを与えるそれは死を削り出した矢であるという蛮族の言うことはいつでも大袈裟だ（アイテム: 不明）\n\n---\n\n暗月の騎士が用いたという魔法の矢銀の光を帯び、魔力ダメージを与えるかつて暗月の神グウィンドリンの手にはこの矢と対になる黄金の弓があったという（アイテム: 不明）\n\n---\n\n鉄槍のような大矢神々の鍛冶たる巨人の作大弓でしか射つことができない神代の竜狩りに用いられたという大矢は人のごときは簡単に貫いてしまうだろう（アイテム: 不明）\n\n---\n\n雷をまとった鉄槍の大矢神々の鍛冶たる巨人の作大弓でしか射つことができない最古の王グウィンからずっと雷は竜狩りの武器であったという（アイテム: 不明）","https://seesaawiki.jp/fromsoft_flavor-text/d/DS3%cc%f0%a1%a6%a5%dc%a5%eb%a5%c8"