作品名,アイテムカテゴリ,アイテム名,フレーバーテキスト,取得先URL
"エルデンリング","道具","聖杯瓶","名前効果入手場所\n緋色の結晶雫最大HPの半分を回復する第三マリカ教会\n小黄金樹(王都外廓)の根元の盆\n緋溢れの結晶雫3分間、HP最大値を1.1倍小黄金樹(アルター高原)のミミズ顔を倒す\n緋湧きの結晶雫3分間、HPを秒間7回復小黄金樹(啜り泣きの半島)の黄金樹の化身を倒す\n緋湧きの枯れ雫(DLC)3分間、周囲の味方のHPを秒間7回復影の城前の焼炉のゴーレム\n青色の結晶雫最大FPの半分を回復する小黄金樹(湖のリエーニエ西部)の黄金樹の化身を倒す\n小黄金樹(巨人たちの山嶺)の黄金樹の化身を倒す\n緑溢れの結晶雫3分間、スタミナ最大値を1.15倍小黄金樹(リムグレイブ)の根元の盆\n緑湧きの結晶雫3分間、スタミナ回復速度を高める小黄金樹(ケイリッド北西)の黄金樹の化身を倒す\n筋力瘤の結晶雫3分間、筋力+10嵐丘のボロ家から北東（戦学びのボロ家から北西）、トロルのいる辺りの盆\n技量瘤の結晶雫3分間、技量+10湖のリエーニエの祝福「見晴らし島」から北西の島の盆\n知力瘤の結晶雫3分間、知力+10湖のリエーニエの祝福「城館への道」と「カーリアの城館、正門」の中間地点あたりの崖下、ユビムシがいる林の中の盆\n信仰瘤の結晶雫3分間、信仰+10亜人森の廃墟から北、ミランダフラワーがいる所の盆\n真珠色の硬雫3分間、すべてのカット率を高める(15％軽減)小黄金樹(グレイオールの竜塚)の腐敗した化身を倒す\n斑彩色の硬雫3分間、耐性+90、状態異常を回復する小黄金樹(アルター高原)のミミズ顔を倒す\n鉛色の硬雫10秒間、スーパーアーマーで怯まない小黄金樹(ゲルミア火山)の爛れた樹霊を倒す\n弾く硬雫(DLC)5分間、瞬間的なガードを強化する。瞬間的なガードに成功するとガードカウンターも強化される墓地平原の焼炉のゴーレム\n魔力纏いの割れ雫3分間、与魔力ダメージ1.2倍小黄金樹(湖のリエーニエ東部)の黄金樹の化身を倒す\n炎纏いの割れ雫3分間、与炎ダメージ1.2倍小黄金樹(ケイリッド北西)の黄金樹の化身を倒す\n雷纏いの割れ雫3分間、与雷ダメージ1.2倍小黄金樹(湖のリエーニエ東部)の黄金樹の化身を倒す\n聖纏いの割れ雫3分間、与聖ダメージ1.2倍\n岩棘の割れ雫30秒間、攻撃で敵の体勢を崩す力とガードに対するスタミナ攻撃力を高める小黄金樹(グレイオールの竜塚)の腐敗した化身を倒す\n大棘の割れ雫3分間、タメ攻撃の与ダメージを1.15倍（魔術/祈祷/戦技のタメ使用は対象外）小黄金樹(リムグレイブ)の根元の盆\n連棘の割れ雫3分間、攻撃が連続するほど攻撃力が高まる小黄金樹(聖別雪原)の腐敗した化身を倒す\n緋吸いの割れ雫(DLC)45秒間、攻撃によりHPを回復するラウフの古遺跡の焼炉のゴーレム\n青吸いの割れ雫(DLC)45秒間、攻撃によりFPを回復するボニ村から北東の焼炉のゴーレム\n吸血の割れ雫(DLC)3分間、攻撃力を高めるがHPが減少し続けるアンテの廃墟の焼炉のゴーレム(大焼炉壺で起動した個体)\n細枝の割れ雫3分間、死亡時にルーンを落とさなくなる小黄金樹(王都外廓)の根元の盆\n羽の結晶雫3分間、最大装備重量を4.5倍にする世捨て商人のボロ家から東北東にある広場の盆夜に行くと死の鳥が出現するため注意\n風の結晶雫3分間、被ダメージが1.15倍になり、ローリングの無敵時間を0.1秒延長するケイリッドの祝福「エオニア沼、南岸」から街道を挟んで真南の窪みにある盆著大鴉が見張っているので注意\nすずらんの結晶雫(DLC)3分間、霊体の攻撃力を高めるカロの隠し墓地の焼炉のゴーレム\n緋色の泡雫3分間、残りHPが20%以下になると一度だけHPを30％回復する（残HP20％以上から即死した場合は発動しない。）小黄金樹(巨人たちの山嶺)の黄金樹の化身を倒す\n緋色渦の泡雫15秒間、受けたダメージをHP回復に変換する(物理ダメージは変換されない)火の頂の祝福「巨人墓標」の南東の崖上にある盆祝福「火の釜の麓」から北東の端まで進み、崖に沿って西へ移動すると細い道にユビムシが群れていて、その先で取得\n真珠色の泡雫3分間、一度だけ被ダメージを90%カットするバリアを得る小黄金樹(啜り泣きの半島)の黄金樹の化身を倒す\n青色の秘雫10秒間、すべてのFP消費がゼロになる。消費FPが最大FPを超える遺灰や魔術/祈祷も使用可小黄金樹(ゲルミア火山)の爛れた樹霊を倒す\n緑色の秘雫(DLC)15秒間、すべてのスタミナ消費がゼロになる墓地平原、祝福「青海岸」から北の焼炉のゴーレムを倒す\n浄血の結晶雫血の君主、モーグが使う数え上げる呪いのダメージを大幅に軽減する第二マリカ教会で純紫の血指、エレオノーラを倒す\n破裂した結晶雫使用すると約三秒後に自爆して自分自身に固定ダメージと周囲の敵に聖属性ダメージを与える小黄金樹(湖のリエーニエ西部)の黄金樹の化身を倒す\n小黄金樹(聖別雪原)の腐敗した化身を倒す\n油ぎった雫(DLC)30秒間、自分と周囲の敵を油まみれにするアンテの廃墟の焼炉のゴーレム","https://kamikouryaku.net/eldenring/?聖杯瓶"
"エルデンリング","道具","ルーンの弧","エルデンリングが砕けた破片\n使用により、装備した大ルーンの恩恵をもたらす\nまた大ルーンを装備しない状態で使用しても\nHPの最大値を少しだけ上昇させる\nエルデンリングの下方には\n輪の恩恵の受け皿、底辺の弧があるとされている\nこれは、その破片であろう","https://kamikouryaku.net/eldenring/?ルーンの弧"
"エルデンリング","道具","星光の欠片","青く輝く、儚い細片\n束の間に流れた星光の残滓\n使用により、FPをゆっくり回復する\nかつて、永遠の都では\n精薬の材料として珍重されたという\nVer.1.00のテキスト\nVer.1.00のテキスト\n天より降り注ぐ、青い星の光\nその残光が欠片として大地に残ったもの\nある種の商人は、これを代価に\n商品を融通してくれるらしい","https://kamikouryaku.net/eldenring/?星光の欠片"
"エルデンリング","道具","微睡の枝","昏紫の祈祷が施された枝木\n製作可能なアイテムのひとつ\n自らに刺し、ゆっくりと睡眠を蓄積する\nその間、FPが少しずつ回復する\nこの睡眠がたまりきった時\n一時朦朧とするが、FPが減少することはない\n微睡の中でこそ、自覚できる意志があり\n心の奥から、浮かび上がる思いがある","https://kamikouryaku.net/eldenring/?微睡の枝"
"エルデンリング","道具","霊馬の指笛","柔らかな金の指輪。指笛として使用する\n霊馬トレントを呼び出し、騎乗する\n（騎乗中に使用すれば、霊馬から降りる）\n霊馬が死亡した後も再度呼び出せるが\n「緋雫の聖杯瓶」が消費されてしまう","https://kamikouryaku.net/eldenring/?霊馬の指笛"
"エルデンリング","道具","毒の苔薬","洞窟苔を用いた緑色の丸薬\n製作可能なアイテムのひとつ\n毒の蓄積を軽減し、毒状態を癒す\n毒は徐々に蓄積し、たまりきると毒状態となる\n毒状態はしばらく続き、HPが減り続ける","https://kamikouryaku.net/eldenring/?毒の苔薬"
"エルデンリング","道具","火炎壺","ヒビ壺を使った製作アイテムのひとつ\n火を生じる素材を混ぜ合わせ、壺に封じたもの\n敵に投げつけ、炎ダメージを与える","https://kamikouryaku.net/eldenring/?火炎壺"
"エルデンリング","道具","調香瓶","","https://kamikouryaku.net/eldenring/?調香瓶"
"エルデンリング","道具","遠眼鏡","カーリア王家の星見の道具\nその一部が取り外され、持ち出されたもの\n遠くの景色が大きく見える\n黄金樹の時代、カーリアの星見は廃れていった\n夜空にあった運命は、黄金の律に縛られたのだ","https://kamikouryaku.net/eldenring/?遠眼鏡"
"エルデンリング","道具","骨の投げ矢","獣骨を鋭く削った投擲用のナイフ\n製作可能なアイテムのひとつ\n敵に投げつけ、ダメージを与える","https://kamikouryaku.net/eldenring/?骨の投げ矢"
"ブラッドボーン","全アイテム","アイテム一覧","ヨセフカの輸血液ヨセフカの診療所、その女医に渡された輸血液精製されたそれは感覚効果が高く、より大きなHPを回復する精製の時間と手間からは、一般的なものではない恐らくは、女医の自製によるものだろうIosefka's Blood VialBlood vial acquired from Iosefka's clinic.This refined blood, highly invigorating, restores a larger amount of HP.The product of a slow and careful refinement process, this rare blood vial appears to be a clinic original.\n\n---\n\nアリアンナの血聖堂街の娼婦アリアンナの「施しの血」彼女の血は甘く、HP回復に加え 一定時間スタミナの回復速度を高める古い医療教会の人間であれば、あるいは気づくだろうか それは、かつて教会の禁忌とされた血に近しいものだBlood of AriannaBlood taken from Arianna, Cathedral Ward woman of pleasure. The sweet blood of Arianna restores HP, and temporarily speeds stamina recovery.A member of the old Healing Church would know that her blood is similar indeed, to precisely what was once forbidden.\n\n---\n\nアデーラの血医療教会の尼僧アデーラの「施しの血」HP回復に加え、一定時間、さらにHPを回復し続ける教会の尼僧たちは、優れた血を宿すべく選ばれ 調整された「血の聖女」であるその施しは、医療教会と拝領の価値の象徴なのだBlood of AdellaBlood taken from Adella, nun of the Healing Church. Restores an amount of HP, then continues to gradually restore HP for a short time.The Healing Church nuns are chosen for their merit as vessels for blood, and groomed as Blood Saints. The mere chance of being treated with their blood lends legitimacy to the Healing Church and communion.\n\n---\n\n輸血液血の医療で使用される特別な血液。HPを回復するヤーナム独特の血の医療を受けたものは以後、同様の輸血により生きる力、その感覚を得る故にヤーナムの民の多くは、血の常習者であるBlood VialSpecial blood used in ministration, Restores HP.Once a patient has had their blood ministrated, a unique butcommon treatment in Yharnam, successive infusions recallthe first, and are all the more invigorating for it.No surprise that most Yharnamites are heavy users of blood.\n\n---\n\n水銀弾獣狩りの銃で使用される特別な弾丸通常の弾丸では、獣に対する効果は期待できないため触媒となる水銀に狩人の血を混ぜ、これを弾丸としたものその威力は血の性質に依存する部分が大きいQuicksilver BulletsSpecial bullets used with hunter firearms.Ordinary bullets have no effect on beasts, and so Quicksilver Bullets, fused with the wielder's own blood, must be employed.The strength of Quicksilver Bullets depends greatly upon the wielder's bloodtinge.\n\n---\n\n白い丸薬毒を治療する小さな丸薬かつて旧市街を蝕んだ奇怪な病、灰血病の治療薬もっとも、その効果はごく一時的なものにすぎず灰血病は、後の悲劇、獣の病蔓延の引き金になってしまったAntidoteSmall medicinal tablets that counteract poison.Used to treat ashen blood, the baffling sickness that ravaged Old Yharnam long ago.These tablets only provide short-term relief. The ashen blood ailment eventually triggered the spread of the beastly scourge.\n\n---\n\n獣血の丸薬獣血を固めたといわれる巨大な丸薬故は分からず、医療教会は禁忌として関わりを否定している飲んだ者を一時の獣性に導く獣性は攻撃により、傷つき裂ける肉と返り血により高まりそれを続けることで、更なる力と快楽を、使用者にもたらすだろうBeast Blood PelletLarge medicinal pellets, supposedly formed of coagulated beast blood. Banned by the Healing Church due to their unclear origin. Grants a spurt of beasthood.""Ripping apart the flesh of one's enemies and being rained up by their splattering blood invigorates one's sense of beasthood, feeding strength and euphoric feeling alike.\n\n---\n\n鎮静剤ビルゲンワース発祥の飲み薬、気を鎮める効果がある神秘の研究者にとって、気の狂いはありふれた症状であり濃厚な人血の類は、そうした気の乱れを沈めてくれるそれはやがて、血の医療へと繋がる萌芽であったSedativeLiquid medicine concocted at Byrgenwerth. Calms the nerves.Those who delve into the arcane fall all-too-easily to madness, and thick human blood serves to calm the frayed nerves of these inquisitive minds. Naturally, this often leads to a reliance on blood ministration.\n\n---\n\n青い秘薬医療教会の上位医療者が、怪しげな実験に用いる飲み薬それは脳を麻痺させる、精神麻酔の類であるだが狩人は、遺志により意識を保ち、その副作用だけを利用するすなわち、動きを止め、己が存在そのものを薄れさせるのだBlue ElixirDubious liquid medicine used in strange experiments conducted by high ministers of the Healing Church.A type of anesthetic that numbs the brain.Hunters, able to retain consciousness by force of will, make use of a secondary effect of the medicine, which dilutes their presence while standing still.\n\n---\n\n鉛の秘薬重苦しくドロリとした飲み薬一時的に比重を高め、攻撃を弾きやすくする効果があるが動きは鈍り、また防御力も変わらないため、使いどころが難しい製法が全く知られていない謎めいた薬であるが一説には、悪夢的な絶望の中でのみ、これが生まれるというLead ElixirA heavy, syrupy liquid medicine.Temporarily shifts Weight to make deflection of attacks easier, but must be used with care, as it also slows movement with no change to defense.Its recipe for this mysterious concoction is unknown, but some postulate that it materializes only within the most desperate nightmares.","https://bloodborne.swiki.jp/index.php?%E3%82%A2%E3%82%A4%E3%83%86%E3%83%A0"
"デモンズソウル","その他","消耗品","月齢の名を持つ薬草使用者のHPを少し回復する月の草は、状態によりその効果が変わる三日月草は、ごく若い月の草を摘んだものである（アイテム: 不明）\n\n---\n\n水に浮かぶ青い花の花弁使用者の出血を癒やすボーレタリアでは、半ば象徴的な意味を込めて出生の儀にて、戦に赴く兵士たちに渡される（アイテム: 不明）\n\n---\n\n水に浮かぶ紅い花の花弁使用者の毒を癒やすその美しさから、貴人の装飾品として有名になった（アイテム: 不明）\n\n---\n\n水に浮かぶ暗い花の花弁使用者の疫病を癒やす疫病に冒されたものを埋葬し、土に還す際に身に着けるが転じて、残された者たちを象徴する花となった（アイテム: 不明）\n\n---\n\n心を落ち着かせる、よい香りの香料使用者のMPを回復する嗜好品として貴族たちに実用品として魔術師たちにそれぞれ重用されている（アイテム: 不明）\n\n---\n\n刺激のある甘い香りを放つ、古い香料使用者のMPを大きく回復する多種多様な発酵物を混ぜ合わせて作られるがこれを作る者たちの素性と、刺激の強さから場所と時代によっては禁制の品となることもある（アイテム: 不明）\n\n---\n\nストーンファングの鍛冶屋エド・ワイズ謹製の研ぎ石右手の武器の損耗を減じ、耐久度を回復する（アイテム: 不明）\n\n---\n\n半ば以上崩れかけた瞳の石使用者の肉体を取り戻すソウルの体でのみ使用することができ使用後は崩れ去り、失われる（アイテム: 不明）\n\n---\n\n各地に点在する、要の石を削り取った欠片使用者を楔の神殿に転送するかつて要人が小人の長たちに託した要の石もやがて忘れられ、ネズミたちが齧るままとなっている（アイテム: 不明）\n\n---\n\n空気に触れ、一時的に光を放つ石宝石の一種として珍重されるが、特に何の効果もないただ、道標として使用できるだろう（アイテム: 不明）","https://seesaawiki.jp/fromsoft_flavor-text/d/Demon%27s%be%c3%cc%d7%c9%ca"
"デモンズソウル","その他","投擲アイテム","投擲用に調整されたナイフ投げつけて攻撃する軽装の騎士などが、予備の武器として携帯することが多い（アイテム: 不明）\n\n---\n\n投擲用に調整された特殊な短刀水平に投げて攻撃する王に飼われた隠密たちが使用する信じられないほど見た目の邪悪な武器（アイテム: 不明）\n\n---\n\n投擲用の、毒の塗られた暗器投げつけて攻撃する刀と同様の、遠い国の武器のひとつ（アイテム: 不明）\n\n---\n\n燃える布で栓をした油壺投げつけると、割れて炎を発生させる（アイテム: 不明）\n\n---\n\nユーザIDを使用しないで書き込む（アイテム: 不明）\n\n---\n\n画像に記載されている文字を下のフォームに入力してください。（アイテム: 不明）\n\n---\n\n利用規約をご確認のうえご記入下さい（アイテム: 不明）\n\n---\n\nフロムソフト フレーバーテキスト\nフロム・ソフトのフレーバーテキストをまとめる場所（アイテム: 不明）\n\n---\n\nDemon's投擲アイテム（アイテム: 不明）\n\n---\n\nスローイングナイフ（英名：Throwing Knife） \n\n説明文英文画像投擲用に調整されたナイフ投げつけて攻撃する軽装の騎士などが、予備の武器として携帯することが多いA knife balanced for throwing. Aim and throw to attack.A handy backup weapon for lightly-equipped knights.（アイテム: 不明）","https://seesaawiki.jp/fromsoft_flavor-text/d/Demon%27s%c5%ea%da%b3%a5%a2%a5%a4%a5%c6%a5%e0"
"デモンズソウル","その他","ソウル","遺体に残っていた、名も無き戦士の魂の名残使用により、使用者のソウルとなるこれを遺体に放っておいても、やがてデーモンの糧になるだけだそれならば…（アイテム: 不明）\n\n---\n\n遺体に残っていた、高名な戦士の魂の名残使用により、使用者のソウルとなるこれを遺体に放っておいても、やがてデーモンの糧になるだけだそれならば…（アイテム: 不明）\n\n---\n\n遺体に残っていた、伝承の戦士の魂の名残使用により、使用者のソウルとなるこれを遺体に放っておいても、やがてデーモンの糧になるだけだそれならば…（アイテム: 不明）\n\n---\n\nユーザIDを使用しないで書き込む（アイテム: 不明）\n\n---\n\n画像に記載されている文字を下のフォームに入力してください。（アイテム: 不明）\n\n---\n\n利用規約をご確認のうえご記入下さい（アイテム: 不明）\n\n---\n\nフロムソフト フレーバーテキスト\nフロム・ソフトのフレーバーテキストをまとめる場所（アイテム: 不明）\n\n---\n\n名も無き戦士のソウル（英名：Unknown Warrior Soul ） \n\n説明文英文画像遺体に残っていた、名も無き戦士の魂の名残使用により、使用者のソウルとなるこれを遺体に放っておいても、やがてデーモンの糧になるだけだそれならば…The remnants of a nameless soldier's spirit that remained in its corpse. Use it and the Souls will be added to your stock. Even if you leave this be, it will only become nourishment for demons. In which case…（アイテム: 不明）\n\n---\n\n名も無き勇者のソウル（英名：Unknown Hero Soul） \n\n説明文英文画像遺体に残っていた、名も無き勇者の魂の名残使用により、使用者のソウルとなるこれを遺体に放っておいても、やがてデーモンの糧になるだけだそれならば…The echoes of a soul found on the corpse of an unknown hero. Consume to gain souls.Go on, if left alone, it would only serve as feed for demons...（アイテム: 不明）\n\n---\n\n高名な戦士のソウル（英名：Renowned Warrior Soul| \n\n説明文英文画像遺体に残っていた、高名な戦士の魂の名残使用により、使用者のソウルとなるこれを遺体に放っておいても、やがてデーモンの糧になるだけだそれならば…The remnants of a renowned soldier's spirit that remained in its corpse. Use it and the Souls will be added to your stock. Even if you leave this be, it will only become nourishment for demons. In which case...（アイテム: 不明）","https://seesaawiki.jp/fromsoft_flavor-text/d/Demon%27s%a5%bd%a5%a6%a5%eb"
"デモンズソウル","その他","デモンズソウル","小さな炎の鱗のデモンズソウル（アイテム: 不明）\n\n---\n\n大きな炎の鱗のデモンズソウル（アイテム: 不明）\n\n---\n\n肥大したデモンズソウル（アイテム: 不明）\n\n---\n\n蝕まれたデモンズソウル（アイテム: 不明）\n\n---\n\n火防女のデモンズソウル（アイテム: 不明）\n\n---\n\n色の無いデモンズソウル（アイテム: 不明）\n\n---\n\nデーモン「ファランクス」のソウル強い力を感じる使用により、使用者に大量のソウルをもたらす他魔法、奇跡、武器などに変じることもある（アイテム: 不明）\n\n---\n\nデーモン「塔の騎士」のソウル強い力を感じる使用により、使用者に大量のソウルをもたらす他魔法、奇跡、武器などに変じることもある（アイテム: 不明）\n\n---\n\nデーモン「つらぬきの騎士」のソウル強い力を感じる使用により、使用者に大量のソウルをもたらす他魔法、奇跡、武器などに変じることもある（アイテム: 不明）\n\n---\n\nデーモン「王の化身」のソウル非常に強い力を感じる使用により、使用者に大量のソウルをもたらす他魔法、奇跡、武器などに変じることもある（アイテム: 不明）","https://seesaawiki.jp/fromsoft_flavor-text/d/Demon%27s%a5%c7%a5%e2%a5%f3%a5%ba%a5%bd%a5%a6%a5%eb"
